{
  "$schema": "../schemas/ptywright-script.schema.json",
  "name": "m5_mask_demo",
  "launch": {
    "command": "bun",
    "args": ["run", "tests/fixtures/random_token_demo.ts"],
    "cwd": ".",
    "cols": 60,
    "rows": 8,
    "name": "xterm-256color"
  },
  "trace": {
    "saveCast": true,
    "saveReport": true,
    "reportScope": "visible",
    "reportMaxFrames": 80
  },
  "steps": [
    {
      "type": "waitForText",
      "scope": "visible",
      "text": "DONE",
      "timeoutMs": 5000,
      "intervalMs": 50
    },
    {
      "type": "snapshot",
      "kind": "text",
      "scope": "visible",
      "trimRight": true,
      "trimBottom": true,
      "mask": [
        {
          "regex": "TOKEN: [0-9a-f-]+",
          "flags": "i",
          "replacement": "TOKEN: <id>"
        }
      ],
      "saveAs": "masked",
      "saveTo": "masked.txt"
    },
    {
      "type": "expect",
      "from": "masked",
      "equals": "TOKEN: <id>\nDONE"
    },
    {
      "type": "snapshot",
      "kind": "view",
      "scope": "visible",
      "trimRight": true,
      "trimBottom": true,
      "lineNumbers": true,
      "mask": [
        {
          "regex": "TOKEN: [0-9a-f-]+",
          "flags": "i",
          "replacement": "TOKEN: <id>"
        }
      ],
      "saveTo": "view.txt"
    }
  ]
}
